{"schema_version":1,"adapter_id":"uos.adapter.synthetic.orion-v1","profile_id":"uos.profile.synthetic.orion-arm64-v1","build_id":"test-only-0.1.0","offline_restore":{"artifact_sha256":"aaaaaaaaaaaaaaaaaaaaaaaaaaaaaaaaaaaaaaaaaaaaaaaaaaaaaaaaaaaaaaaa","data_loss_disclosed":true},"scenario":"interrupted-update","result":"recovered","evidence":"Synthetic host fixture only; no physical recovery claim."}
